mysql> SOURCE C:\Users\13158\OneDrive\Desktop\ISTE230\Homework Assingments\HW7\Pundt_HW7.sql
--------------
DROP DATABASE IF EXISTS Pundt_ACMEOnline
--------------

Query OK, 10 rows affected (0.07 sec)

--------------
CREATE DATABASE Pundt_ACMEOnline
--------------

Query OK, 1 row affected (0.00 sec)

Database changed
--------------
CREATE TABLE CATEGORY(
	categoryName VARCHAR(35),
	shippingPerPound DECIMAL(4, 2),
	offersAllowed CHAR CHECK (offersAllowed="y" OR offersAllowed="n"),
	CONSTRAINT company_pk PRIMARY KEY (categoryName)
	)ENGINE=InnoDB DEFAULT CHARSET=utf8
--------------

Query OK, 0 rows affected, 1 warning (0.01 sec)

--------------
DESCRIBE CATEGORY
--------------

+------------------+--------------+------+-----+---------+-------+
| Field            | Type         | Null | Key | Default | Extra |
+------------------+--------------+------+-----+---------+-------+
| categoryName     | varchar(35)  | NO   | PRI | NULL    |       |
| shippingPerPound | decimal(4,2) | YES  |     | NULL    |       |
| offersAllowed    | char(1)      | YES  |     | NULL    |       |
+------------------+--------------+------+-----+---------+-------+
3 rows in set (0.00 sec)

--------------
CREATE TABLE OFFER(
	offerCode VARCHAR(15),
	discountAmt VARCHAR(35) NOT NULL DEFAULT 0,
	minAmount DECIMAL(4, 2) NOT NULL DEFAULT 0,
	expirationDate DATE NOT NULL DEFAULT "1999-01-01",
	CONSTRAINT offer_pk PRIMARY KEY(offerCode)
	)ENGINE=InnoDB DEFAULT CHARSET=utf8
--------------

Query OK, 0 rows affected, 1 warning (0.01 sec)

--------------
DESCRIBE OFFER
--------------

+----------------+--------------+------+-----+------------+-------+
| Field          | Type         | Null | Key | Default    | Extra |
+----------------+--------------+------+-----+------------+-------+
| offerCode      | varchar(15)  | NO   | PRI | NULL       |       |
| discountAmt    | varchar(35)  | NO   |     | 0          |       |
| minAmount      | decimal(4,2) | NO   |     | 0.00       |       |
| expirationDate | date         | NO   |     | 1999-01-01 |       |
+----------------+--------------+------+-----+------------+-------+
4 rows in set (0.00 sec)

--------------
CREATE TABLE CUSTOMER(
	customerID INTEGER UNSIGNED AUTO_INCREMENT,
	customerName VARCHAR(50) NOT NULL,
	address VARCHAR(150) NOT NULL,
	email VARCHAR(80),
	businessCustomer CHAR NOT NULL CHECK(businessCustomer="y" OR businessCustomer="n") DEFAULT "n",
	homeCustomer CHAR NOT NULL CHECK(homeCustomer="y" OR homeCustomer="n") DEFAULT "n",
	CONSTRAINT customer_pk PRIMARY KEY(customerID)
	)ENGINE=InnoDB DEFAULT CHARSET=utf8
--------------

Query OK, 0 rows affected, 1 warning (0.01 sec)

--------------
DESCRIBE CUSTOMER
--------------

+------------------+--------------+------+-----+---------+----------------+
| Field            | Type         | Null | Key | Default | Extra          |
+------------------+--------------+------+-----+---------+----------------+
| customerID       | int unsigned | NO   | PRI | NULL    | auto_increment |
| customerName     | varchar(50)  | NO   |     | NULL    |                |
| address          | varchar(150) | NO   |     | NULL    |                |
| email            | varchar(80)  | YES  |     | NULL    |                |
| businessCustomer | char(1)      | NO   |     | n       |                |
| homeCustomer     | char(1)      | NO   |     | n       |                |
+------------------+--------------+------+-----+---------+----------------+
6 rows in set (0.00 sec)

--------------
CREATE TABLE BUSINESS(
	customerID INTEGER UNSIGNED AUTO_INCREMENT,
	paymentTerms VARCHAR(50) NOT NULL,
	CONSTRAINT business_pk PRIMARY KEY(customerID),
	CONSTRAINT business_customerID_fk FOREIGN KEY(customerID) REFERENCES CUSTOMER(customerID)
		ON UPDATE CASCADE
	)ENGINE=InnoDB DEFAULT CHARSET=utf8
--------------

Query OK, 0 rows affected, 1 warning (0.01 sec)

--------------
DESCRIBE BUSINESS
--------------

+--------------+--------------+------+-----+---------+----------------+
| Field        | Type         | Null | Key | Default | Extra          |
+--------------+--------------+------+-----+---------+----------------+
| customerID   | int unsigned | NO   | PRI | NULL    | auto_increment |
| paymentTerms | varchar(50)  | NO   |     | NULL    |                |
+--------------+--------------+------+-----+---------+----------------+
2 rows in set (0.00 sec)

--------------
CREATE TABLE HOME(
	customerID INTEGER UNSIGNED AUTO_INCREMENT,
	creditCardNum CHAR(16) NOT NULL,
	cardExpiration CHAR(6) NOT NULL,
	CONSTRAINT home_pk PRIMARY KEY(customerID),
	CONSTRAINT home_customerID_fk FOREIGN KEY(customerID) REFERENCES CUSTOMER(customerID)
		ON UPDATE CASCADE
	)ENGINE=InnoDB DEFAULT CHARSET=utf8
--------------

Query OK, 0 rows affected, 1 warning (0.01 sec)

--------------
DESCRIBE HOME
--------------

+----------------+--------------+------+-----+---------+----------------+
| Field          | Type         | Null | Key | Default | Extra          |
+----------------+--------------+------+-----+---------+----------------+
| customerID     | int unsigned | NO   | PRI | NULL    | auto_increment |
| creditCardNum  | char(16)     | NO   |     | NULL    |                |
| cardExpiration | char(6)      | NO   |     | NULL    |                |
+----------------+--------------+------+-----+---------+----------------+
3 rows in set (0.00 sec)

--------------
CREATE TABLE PURCHASE_CONTACT(
	contactName VARCHAR(50),
	customerID INTEGER UNSIGNED AUTO_INCREMENT,
	contactPhone CHAR(12) NOT NULL,
	CONSTRAINT pcontact_pk PRIMARY KEY(contactName, customerID),
	CONSTRAINT pcontact_customerID_fk FOREIGN KEY(customerID) REFERENCES BUSINESS(customerID)
		ON DELETE CASCADE
		ON UPDATE CASCADE
	)ENGINE=InnoDB DEFAULT CHARSET=utf8
--------------

Query OK, 0 rows affected, 1 warning (0.03 sec)

--------------
DESCRIBE PURCHASE_CONTACT
--------------

+--------------+--------------+------+-----+---------+----------------+
| Field        | Type         | Null | Key | Default | Extra          |
+--------------+--------------+------+-----+---------+----------------+
| contactName  | varchar(50)  | NO   | PRI | NULL    |                |
| customerID   | int unsigned | NO   | PRI | NULL    | auto_increment |
| contactPhone | char(12)     | NO   |     | NULL    |                |
+--------------+--------------+------+-----+---------+----------------+
3 rows in set (0.00 sec)

--------------
CREATE TABLE ITEM(
	itemNumber INTEGER UNSIGNED AUTO_INCREMENT,
	itemName VARCHAR(35) NOT NULL,
	description VARCHAR(255),
	modelNum VARCHAR(50) NOT NULL,
	price DECIMAL(8, 2) NOT NULL,
	categoryName VARCHAR(35),
	CONSTRAINT item_pk PRIMARY KEY(itemNumber),
	CONSTRAINT item_categoryName_fk FOREIGN KEY(categoryName) REFERENCES CATEGORY(categoryName)
		ON UPDATE CASCADE
	)ENGINE=InnoDB DEFAULT CHARSET=utf8
--------------

Query OK, 0 rows affected, 1 warning (0.02 sec)

--------------
DESCRIBE ITEM
--------------

+--------------+--------------+------+-----+---------+----------------+
| Field        | Type         | Null | Key | Default | Extra          |
+--------------+--------------+------+-----+---------+----------------+
| itemNumber   | int unsigned | NO   | PRI | NULL    | auto_increment |
| itemName     | varchar(35)  | NO   |     | NULL    |                |
| description  | varchar(255) | YES  |     | NULL    |                |
| modelNum     | varchar(50)  | NO   |     | NULL    |                |
| price        | decimal(8,2) | NO   |     | NULL    |                |
| categoryName | varchar(35)  | YES  | MUL | NULL    |                |
+--------------+--------------+------+-----+---------+----------------+
6 rows in set (0.00 sec)

--------------
CREATE TABLE ORDERED(
	orderID INTEGER UNSIGNED AUTO_INCREMENT,
	totalCost DECIMAL(10, 2),
	customerID INTEGER UNSIGNED,
	offerCode VARCHAR(15),
	CONSTRAINT ordered_pk PRIMARY KEY(orderID),
	CONSTRAINT ordered_customerID_fk FOREIGN KEY(customerID) REFERENCES CUSTOMER(customerID)
		ON UPDATE CASCADE,
	CONSTRAINT ordered_offerCode_fk FOREIGN KEY(offerCode) REFERENCES OFFER(offerCode)
		ON UPDATE CASCADE
	)ENGINE=InnoDB DEFAULT CHARSET=utf8
--------------

Query OK, 0 rows affected, 1 warning (0.03 sec)

--------------
DESCRIBE ORDERED
--------------

+------------+---------------+------+-----+---------+----------------+
| Field      | Type          | Null | Key | Default | Extra          |
+------------+---------------+------+-----+---------+----------------+
| orderID    | int unsigned  | NO   | PRI | NULL    | auto_increment |
| totalCost  | decimal(10,2) | YES  |     | NULL    |                |
| customerID | int unsigned  | YES  | MUL | NULL    |                |
| offerCode  | varchar(15)   | YES  | MUL | NULL    |                |
+------------+---------------+------+-----+---------+----------------+
4 rows in set (0.00 sec)

--------------
CREATE TABLE LINE_ITEM(
	itemNumber INTEGER UNSIGNED,
	orderID INTEGER UNSIGNED,
	quantity TINYINT,
	shippingAmount DECIMAL(6, 2),
	CONSTRAINT line_item_pk PRIMARY KEY(itemNumber, orderID),
	CONSTRAINT line_item_itemNumber_fk FOREIGN KEY(itemNumber) REFERENCES ITEM(itemNumber)
		ON DELETE CASCADE
		ON UPDATE CASCADE,
	CONSTRAINT line_item_orderID_fk FOREIGN KEY(orderID) REFERENCES ORDERED(orderID)
		ON UPDATE CASCADE
	)ENGINE=InnoDB DEFAULT CHARSET=utf8
--------------

Query OK, 0 rows affected, 1 warning (0.02 sec)

--------------
DESCRIBE LINE_ITEM
--------------

+----------------+--------------+------+-----+---------+-------+
| Field          | Type         | Null | Key | Default | Extra |
+----------------+--------------+------+-----+---------+-------+
| itemNumber     | int unsigned | NO   | PRI | NULL    |       |
| orderID        | int unsigned | NO   | PRI | NULL    |       |
| quantity       | tinyint      | YES  |     | NULL    |       |
| shippingAmount | decimal(6,2) | YES  |     | NULL    |       |
+----------------+--------------+------+-----+---------+-------+
4 rows in set (0.00 sec)

--------------
CREATE TABLE GUARANTEE(
	orderID INTEGER UNSIGNED,
	customerID INTEGER UNSIGNED,
	url VARCHAR(50),
	refundAmount DECIMAL(12, 2),
	CONSTRAINT guarantee_pk PRIMARY KEY(orderID, customerID),
	CONSTRAINT guarantee_orderID_fk FOREIGN KEY(orderID) REFERENCES ORDERED(orderID)
		ON UPDATE CASCADE
		ON DELETE CASCADE,
	CONSTRAINT guarantee_customerID_fk FOREIGN KEY(customerID) REFERENCES HOME(customerID)
		ON UPDATE CASCADE
	)ENGINE=InnoDB DEFAULT CHARSET=utf8
--------------

Query OK, 0 rows affected, 1 warning (0.03 sec)

--------------
DESCRIBE GUARANTEE
--------------

+--------------+---------------+------+-----+---------+-------+
| Field        | Type          | Null | Key | Default | Extra |
+--------------+---------------+------+-----+---------+-------+
| orderID      | int unsigned  | NO   | PRI | NULL    |       |
| customerID   | int unsigned  | NO   | PRI | NULL    |       |
| url          | varchar(50)   | YES  |     | NULL    |       |
| refundAmount | decimal(12,2) | YES  |     | NULL    |       |
+--------------+---------------+------+-----+---------+-------+
4 rows in set (0.00 sec)

--------------
INSERT INTO CATEGORY 
VALUES
	("Books", 0.99, "y"),
	("Home", 1.99, "y"),
	("Jewelry", 0.99, "n"),
	("Toys", 0.99, "y")
--------------

Query OK, 4 rows affected (0.00 sec)
Records: 4  Duplicates: 0  Warnings: 0

--------------
SELECT *
FROM CATEGORY
--------------

+--------------+------------------+---------------+
| categoryName | shippingPerPound | offersAllowed |
+--------------+------------------+---------------+
| Books        |             0.99 | y             |
| Home         |             1.99 | y             |
| Jewelry      |             0.99 | n             |
| Toys         |             0.99 | y             |
+--------------+------------------+---------------+
4 rows in set (0.00 sec)

--------------
INSERT INTO ITEM (itemName, description, modelNum, price, categoryName)
VALUES
	("Cabbage Patch Doll", "Baby boy doll", "Boy", 39.95, "Toys"),
	("The Last Lecture", "Written by Randy Pausch", "Hardcover", 9.95, "Books"),
	("Keurig Beverage Maker", "Keurig Platinum Edition Beverage Maker in Red", "Platinum Edition", 299.95, "Home"),
	("1ct Diamond Ring in White Gold", "Diamond is certified vvs, D, round", "64gt32", 4000.00, "Jewelry")
--------------

Query OK, 4 rows affected (0.00 sec)
Records: 4  Duplicates: 0  Warnings: 0

--------------
SELECT *
FROM ITEM
--------------

+------------+--------------------------------+-----------------------------------------------+------------------+---------+--------------+
| itemNumber | itemName                       | description                                   | modelNum         | price   | categoryName |
+------------+--------------------------------+-----------------------------------------------+------------------+---------+--------------+
|          1 | Cabbage Patch Doll             | Baby boy doll                                 | Boy              |   39.95 | Toys         |
|          2 | The Last Lecture               | Written by Randy Pausch                       | Hardcover        |    9.95 | Books        |
|          3 | Keurig Beverage Maker          | Keurig Platinum Edition Beverage Maker in Red | Platinum Edition |  299.95 | Home         |
|          4 | 1ct Diamond Ring in White Gold | Diamond is certified vvs, D, round            | 64gt32           | 4000.00 | Jewelry      |
+------------+--------------------------------+-----------------------------------------------+------------------+---------+--------------+
4 rows in set (0.00 sec)

--------------
INSERT INTO OFFER
VALUES
	("345743213", "20% off", 20.00, '2013-12-31'),
	("4567890123", "30% off", 30.00, '2013-12-31')
--------------

Query OK, 2 rows affected (0.00 sec)
Records: 2  Duplicates: 0  Warnings: 0

--------------
SELECT *
FROM OFFER
--------------

+------------+-------------+-----------+----------------+
| offerCode  | discountAmt | minAmount | expirationDate |
+------------+-------------+-----------+----------------+
| 345743213  | 20% off     |     20.00 | 2013-12-31     |
| 4567890123 | 30% off     |     30.00 | 2013-12-31     |
+------------+-------------+-----------+----------------+
2 rows in set (0.00 sec)

--------------
START TRANSACTION
--------------

Query OK, 0 rows affected (0.00 sec)

--------------
INSERT INTO CUSTOMER (customerName, address, email)
		VALUES
			("Jaine Jeffers", "152 Lomb Memorial Dr., Rochester, NY, 14623", "jxj1234@rit.edu")
--------------

Query OK, 1 row affected (0.00 sec)

--------------
INSERT INTO HOME (customerID, creditCardNum, cardExpiration)
			SELECT customerID, "1234567890123456", "012014" 
			FROM CUSTOMER
			WHERE customerName = "Jaine Jeffers"
--------------

Query OK, 1 row affected (0.00 sec)
Records: 1  Duplicates: 0  Warnings: 0

--------------
UPDATE CUSTOMER
		SET homeCustomer="y"
		WHERE customerName = "Jaine Jeffers"
--------------

Query OK, 1 row affected (0.00 sec)
Rows matched: 1  Changed: 1  Warnings: 0

--------------
INSERT INTO ORDERED (totalCost, customerID, offerCode)
		VALUES
			(4919.75, (SELECT customerID FROM CUSTOMER WHERE customerName = "Jaine Jeffers"), "4567890123")
--------------

Query OK, 1 row affected (0.00 sec)

--------------
INSERT INTO LINE_ITEM(itemNumber, orderID, quantity, shippingAmount)
		VALUES
			(4, (SELECT orderID FROM ORDERED WHERE customerID = 1), "1", 0.99),
			(2, (SELECT orderID FROM ORDERED WHERE customerID = 1), "2", 3.99)
--------------

Query OK, 2 rows affected (0.00 sec)
Records: 2  Duplicates: 0  Warnings: 0

--------------
INSERT INTO LINE_ITEM (itemNumber, orderID, quantity)
		VALUES
			(3, 1, "3")
--------------

Query OK, 1 row affected (0.00 sec)

--------------
COMMIT
--------------

Query OK, 0 rows affected (0.00 sec)

--------------
SELECT *
FROM CUSTOMER
--------------

+------------+---------------+---------------------------------------------+-----------------+------------------+--------------+
| customerID | customerName  | address                                     | email           | businessCustomer | homeCustomer |
+------------+---------------+---------------------------------------------+-----------------+------------------+--------------+
|          1 | Jaine Jeffers | 152 Lomb Memorial Dr., Rochester, NY, 14623 | jxj1234@rit.edu | n                | y            |
+------------+---------------+---------------------------------------------+-----------------+------------------+--------------+
1 row in set (0.00 sec)

--------------
SELECT *
FROM HOME
--------------

+------------+------------------+----------------+
| customerID | creditCardNum    | cardExpiration |
+------------+------------------+----------------+
|          1 | 1234567890123456 | 012014         |
+------------+------------------+----------------+
1 row in set (0.00 sec)

--------------
SELECT *
FROM ORDERED
--------------

+---------+-----------+------------+------------+
| orderID | totalCost | customerID | offerCode  |
+---------+-----------+------------+------------+
|       1 |   4919.75 |          1 | 4567890123 |
+---------+-----------+------------+------------+
1 row in set (0.00 sec)

--------------
SELECT *
FROM LINE_ITEM
--------------

+------------+---------+----------+----------------+
| itemNumber | orderID | quantity | shippingAmount |
+------------+---------+----------+----------------+
|          2 |       1 |        2 |           3.99 |
|          3 |       1 |        3 |           NULL |
|          4 |       1 |        1 |           0.99 |
+------------+---------+----------+----------------+
3 rows in set (0.00 sec)

--------------
START TRANSACTION
--------------

Query OK, 0 rows affected (0.00 sec)

--------------
INSERT INTO CUSTOMER (customerName, address, email)
		VALUES
			("Joey John Barber Shop", "15 John St., Rochester, NY, 14623", "jj1978@hotmail.com")
--------------

Query OK, 1 row affected (0.00 sec)

--------------
INSERT INTO BUSINESS(paymentTerms, customerID)
		VALUES
			("30/90 Days", 2)
--------------

Query OK, 1 row affected (0.00 sec)

--------------
UPDATE CUSTOMER
		SET businessCustomer="y"
		WHERE customerName = "Joey John Barber Shop"
--------------

Query OK, 1 row affected (0.00 sec)
Rows matched: 1  Changed: 1  Warnings: 0

--------------
INSERT INTO ORDERED (totalCost, customerID, offerCode)
		VALUES
			(299.95, (SELECT  customerID FROM CUSTOMER WHERE customerName = "Joey John Barber Shop"), "345743213")
--------------

Query OK, 1 row affected (0.00 sec)

--------------
INSERT INTO LINE_ITEM (orderID, itemNumber, quantity)
		VALUES
			(2, 3, "1")
--------------

Query OK, 1 row affected (0.00 sec)

--------------
INSERT INTO PURCHASE_CONTACT(contactName, customerID, contactPhone)
		VALUES
			('Joey James', (SELECT customerID FROM CUSTOMER WHERE customerName="Joey John Barber Shop"), "585-475-1234")
--------------

Query OK, 1 row affected (0.00 sec)

--------------
COMMIT
--------------

Query OK, 0 rows affected (0.00 sec)

--------------
SELECT *
FROM CUSTOMER
--------------

+------------+-----------------------+---------------------------------------------+--------------------+------------------+--------------+
| customerID | customerName          | address                                     | email              | businessCustomer | homeCustomer |
+------------+-----------------------+---------------------------------------------+--------------------+------------------+--------------+
|          1 | Jaine Jeffers         | 152 Lomb Memorial Dr., Rochester, NY, 14623 | jxj1234@rit.edu    | n                | y            |
|          2 | Joey John Barber Shop | 15 John St., Rochester, NY, 14623           | jj1978@hotmail.com | y                | n            |
+------------+-----------------------+---------------------------------------------+--------------------+------------------+--------------+
2 rows in set (0.00 sec)

--------------
SELECT *
FROM BUSINESS
--------------

+------------+--------------+
| customerID | paymentTerms |
+------------+--------------+
|          2 | 30/90 Days   |
+------------+--------------+
1 row in set (0.00 sec)

--------------
SELECT *
FROM ORDERED
--------------

+---------+-----------+------------+------------+
| orderID | totalCost | customerID | offerCode  |
+---------+-----------+------------+------------+
|       1 |   4919.75 |          1 | 4567890123 |
|       2 |    299.95 |          2 | 345743213  |
+---------+-----------+------------+------------+
2 rows in set (0.00 sec)

--------------
SELECT *
FROM LINE_ITEM
--------------

+------------+---------+----------+----------------+
| itemNumber | orderID | quantity | shippingAmount |
+------------+---------+----------+----------------+
|          2 |       1 |        2 |           3.99 |
|          3 |       1 |        3 |           NULL |
|          3 |       2 |        1 |           NULL |
|          4 |       1 |        1 |           0.99 |
+------------+---------+----------+----------------+
4 rows in set (0.00 sec)

--------------
SELECT *
FROM PURCHASE_CONTACT
--------------

+-------------+------------+--------------+
| contactName | customerID | contactPhone |
+-------------+------------+--------------+
| Joey James  |          2 | 585-475-1234 |
+-------------+------------+--------------+
1 row in set (0.00 sec)

--------------
COMMIT
--------------

Query OK, 0 rows affected (0.00 sec)

mysql> quit
